username,orig_sentence,cleaned_sentence,category,sub-category
tweets_INCObaid,"#BharatJodoYatra has brought ""Manhgai and Berojgari"" at the centre stage of the discussion.

BJP and it's supporters are trying hard to communalise the discussion again.

Nation will not engage itself in any communal discussion, for them ""Rozi, Roti and Shanti"" are important. https://t.co/ssMpse85qJ",bring manhgai berojgari centre stage discussion bjp supporter try hard communalise discussion nation not engage communal discussion rozi roti shanti important,positive,
tweets_freuslip,"Inspired by #BharatJodoYatra, Modi ji has decided to walk 56 steps a day to keep his Fitbit active.",inspire modi ji decide walk 56 step day keep fitbit active,negative,hate
tweets_Puneetvizh,"@TweetInder @SamHarris2429 @shuchitasrivast @JoeSaldanha @Trendsetting123 @SethLalits @Ajaykumar00009 @KJSingh12518759 @ronaldrajanna @priyankagandhi @fredhamilton @LambaAlka @RahulGandhi @pathan_neamath @SaddamSamsadINC @geetv79 @kukk44 @SujataIndia1st @psmanwatkar @priyapyadav18 @watdehel @PadmraniK @rkmarar9 @WeThePeople3009 @shubhshaurya1 @inbred_mind @Subytweets @ranjona @Malz59408224 @mrsinghCricUmp @Aakar__Patel @silvestercliff @terence_fdes @tjose66 @RaniPadmaK @09mitali @aniljames65_inc @nandtara @Alwynmoras4870 @75 @PriyaaReturnz @ManojMehtamm @BN34772728 @priyankac19 @Pawankhera @kap_bee @AliyaAbbas @NayakRagini What the #BharatJodoYatra Is, Isn't and Should Be.What is needed is not a refix (Jodo) with the old but a complete reconstruction of India (Punarnirman) to mount a challenge to the political, ideological and organisational might of the BJP.  https://t.co/TDyvzynFpU",isnt bewhat need not refix jodo old complete reconstruction india punarnirman mount challenge political ideological organisational might bjp,positive,
tweets_Hillalahmed5,"Humility requires courage and the name Gandhi is known for both.

#BharatJodoYatra https://t.co/gBgfFzNBf0",humility require courage name gandhi know,positive,
tweets_archansr,"@ShashiTharoor @kunalkamra88 @virdas @munawar0018 This been norm in PM Modi’s NewIndia. 

@RahulGandhi @INCIndia from day1 fighting this autocratic regressive communal fascist Modi Regime. Awful that, these kinds will never stand with RG/INC, Instead literally act as enablers, if not dare these join historic #BharatJodoYatra🇮🇳 https://t.co/sjfBiVJVw0",norm pm modis newindia day1 fight autocratic regressive communal fascist modi regime awful kind never stand rginc instead literally act enablers not dare join historic,negative,hate
tweets_StayingReal0511,"The Bharat Yatris are in high spirits as they embark on their 7th day of Padayatra from Thiruvananthapuram,on a mission to defeat the politics of #hate &amp; foster unity &amp; brotherhood
#BharatJodoYatra https://t.co/iIDAtOTGVp",bharat yatris high spirit embark 7th day padayatra thiruvananthapuramon mission defeat politics foster unity brotherhood,positive,
tweets_SASIKANTSINGH10,"Shri @RahulGandhi Ji with Shri @LaljiDesaiG Ji and warriors of @CongressSevadal who are walking together in the Bharat Jodo Yatra.

 #BharatJodoYatra 🇮🇳 
#BharatJodoYatra🙏 https://t.co/dn60nZH8Rg",shri ji shri ji warrior walk together bharat jodo yatra,positive,
tweets_ayu_shri,Opposition parties can't even choose their leader in the Lok sabha and they are shouting for #BharatJodoYatra ... are pehle khud to Jod jao 🤣. @RahulGandhi @ArvindKejriwal #LOL @TheSicario5 @NathMeghali @TDasKumar @AnkitaD39927893 @pari_Saikia1 @Misty_Kaushik @BJP4India https://t.co/rICSiZ020N,opposition party cant even choose leader lok sabha shout pehle khud jod jao,negative,hate
tweets_aanand_UP16,"The bond of Arvind Kejriwal and auto driver script is as strong as NDTV and fake news.
#KejriwalRukegaNahi #BharatJodoYatra",bond arvind kejriwal auto driver script strong ndtv fake news,negative,hate
tweets_Kushwaha72,"@RahulGandhi is the leader of the world. The world eyes are on his #BharatJodoYatra. Everyone is surprised seeing love from all age people for him, just as #Mahatma_Gandhi ji #Nehru ji. #RahulGandhi can lead the world like #Rajiv_Gandhi ji and Grandmother #Indira_Gandhi ji.",leader world world eye everyone surprise see love age people ji ji lead world like ji grandmother ji,positive,
tweets_tanishq_deo,@ApoCurious @RahulGandhi @priyankagandhi @INCIndia @SachinPilot @Jairam_Ramesh Not the other person is wrong bjp is wrong because the way they are spreading the hatered that is destroying the integrity of our nation . People gave their mandate to develop not to destroy india #BharatJodoYatra,not person wrong bjp wrong way spread hatered destroy integrity nation people give mandate develop not destroy india,negative,hate
tweets_QlnNews,hraja latest angry speech #shorts #hraja #bjp #bjphraja #hrajalatestspeech #BharatJodoYatra  #RahulGandhiTShirt @HRajaBJP @QlnNews https://t.co/BkI65GyC1M,hraja late angry speech,positive,
tweets_INC_Television,"Kerala does not allow for itself to be divided,

Kerala does not allow for hate to be spread.

The #BharatJodoYatra is just an extension of the ideas that prevail in Kerala https://t.co/spCsBQDMBl",kerala not allow divide kerala not allow hate spread extension idea prevail kerala,positive,
tweets_Francis_INC_,"The enthusiasm of all the Padyatris &amp; the people of Kerala has been exceptional. 
Early morning scenes from Thiruvananthapuram.
#BharatJodoYatra 🇮🇳
Jai Hind Jai Congress 🇮🇳
@RahulGandhi @LaljiDesaiG https://t.co/AazyJsJQup",enthusiasm padyatris people kerala exceptional early morning scene thiruvananthapuram jai hind jai congress,positive,
tweets_SevadalKL,"What is the significance of Bharat Jodo Yatra? Why should Congress come back? Renowned director Mr. Adoor Gopalakrishnan, who participated in the trip, says. #BharatJodoYatra https://t.co/Q01QQbAseB",significance bharat jodo yatra congress come back renowned director mr adoor gopalakrishnan participate trip say,negative,hate
tweets__bjp4abhishek_,"On the other hand Raga himself meets and greets infamous pastors known for abusing Hindutva and Indian nationalism..

Great work !! India needs no further proof of Congress Party's intentions and sincerity towards the nation. 🙂

#BharatJodoYatra",hand raga meet greet infamous pastor know abuse hindutva indian nationalism great work india need proof congress partys intention sincerity towards nation,negative,hate
tweets_amarpatil07,"@BJP4India why you people are so upset with #BharatJodoYatra ? focus on development, high inflation, unemployment .
चरम सीमा पर है बेरोजगारी और महंगाई",people upset focus development high inflation unemployment,positive,
tweets_isarifulmallick,"Communist Party of India (Marxist) criticises Congress' 'Bharat Jodo Yatra', says spending 18 days in Left-ruled Kerala and just two in BJP-ruled Uttar Pradesh is a ""strange way to fight BJP-RSS""

#BharatJodoYatra 
(PTI) https://t.co/Bz0sr1jxGZ",communist party india marxist criticises congress bharat jodo yatra say spending 18 day leftruled kerala two bjpruled uttar pradesh strange way fight bjprss pti,negative,hate
tweets_NageshraoH,"@vijaythottathil @chennai123 18 days in Kerala and 2 days in UP - CPI(M)

CPI(M) too could have use of these 18 days to rid India of hate and divisiveness by joining #BharatJodoYatra instead of complaining.
Or is it that agenda of CPI(M) and BJP is the same?
CPI(M) has a lot of explaining to do!",18 day kerala 2 day cpim cpim could use 18 day rid india hate divisiveness join instead complain agenda cpim bjp cpim lot explain,negative,critisism
tweets_munsifdigital,"Rahul Gandhi will interacts with rural labourers, leaders of Communist Marxist Party (CMP) and representatives of anti K-Rail agitation committee.

#MunsifDigital
#Congress
#BharatJodoYatra
#RahulGandhi
#HugeTurnout https://t.co/iYS0w9lcxS",rahul gandhi interact rural labourer leader communist marxist party cmp representative anti krail agitation committee,negative,hate
tweets_GujSagar,"@GauravPandhi @GHANSHYAMJANJI4 @RahulGandhi @priyankagandhi Take her to padyatra incharge. She deserves the amenities that other yatris are availing.
#BharatJodoYatra 2022.
Every Indian is participant (except sanghis).",take padyatra incharge deserve amenity yatris avail 2022 every indian participant except sanghis,negative,hate
tweets_KjdSingh,"Now its revealed, #BharatJodoYatra is nothing but a PR exercise to project #RahulGandhi all this talk of uniting the nation and unity is a side issue, taking on #BJP or #NarendraModi's hate politics not even on the radar  main agenda is owl gandi's image

https://t.co/ZiFrazE35g",reveal nothing pr exercise project talk unite nation unity side issue take hate politics not even radar main agenda owl gandis image,negative,hate
tweets_KaurageousDils,"The decline of Cong started way back in 2014
RaGa does not have it in him to lead a major national party but his mother in her putra-moh is unwilling to allow the Cong to be taken over by someone capable
#BharatJodoYatra is just another attempt to relaunch the inefficient 'Dud'",decline cong start way back 2014 raga not lead major national party mother putramoh unwilling allow cong take someone capable another attempt relaunch inefficient dud,negative,hate
tweets_affy1901,"After this, BJP and its apes sena trolls: #BharatJodoYatra is #jihadi #antinational #antiHindu https://t.co/a77RDF2ogp",bjp ape sena troll,negative,hate
tweets_papu_patwari,"come join hands together for a better india its all about indians 
Lets walk together to spread love 
n save democarsy of india 
#BharatJodoYatra https://t.co/lHOpV4PXDB",come join hand together good india indian let walk together spread love n save democarsy india,positive,
tweets_Rahulgu09736439,"@Jairam_Ramesh I capture all the moment f rahulgandhi &amp; inc in my utube channel please share &amp; spread all the video of rg bcz godi media is no more &amp; thy r not covering #BharatJodoYatra request all cong. worker support me utube&amp; tweeter spread kindness of rahul ji #Share
https://t.co/ArEQMXicXR",capture moment f rahulgandhi inc utube channel please share spread video rg bcz godi medium thy r not cover request cong worker support utubetweeter spread kindness rahul ji,negative,critisism
tweets_Faiz_INC,"Corruption is on its Peak wherever BJP or its allies are in power.

#BharatJodoYatra https://t.co/FSphZiwdR5",corruption peak wherever bjp ally power,negative,critisism
tweets_JanakiMenon5,"There is no better movie than Sandhesham which had aptly captured the dramatic stunts performed by our politicians to fool the public. 

#BharatJodoYatra https://t.co/YYmM9X3vdg",well movie sandhesham aptly capture dramatic stunt perform politician fool public,negative,hate
tweets_AnimeshUpadhay5,"many people say many things about him . some say papu some say etc. If papu is this then india need this type of papu.
#BharatJodoYatra https://t.co/CtQtqOKn3v",many people say many thing say papu say etc papu india need type papu,positive,
tweets_MadhupGarg,"By opposing #BharatJodoYatra on flimsy, false and diversionary issues, @BJP4India is helping @INCIndia gain lost ground. People are coming back because they are loving the new energy. 
BJP should stop playing dirty games and respond to people's issues.",oppose flimsy false diversionary issue help gain lose ground people come back love new energy bjp stop play dirty game respond people issue,negative,critisism
tweets_SanskariStree,@RagaTimes Also I do t think it’s all just innocent. Certainly the response to #BharatJodoYatra has been triggering for Sanghis and this is venting of a form. Probably part of a concerted effort.,also think innocent certainly response trigger sanghis vent form probably part concert effort,negative,hate
tweets_FeedmileApp,"Do you believe that the ""Bharat Jodo Yatra"" would help Congress regain its footing?
#feedmile #BharatJodoYatra #Congress #bharatjodoyatrakerala #CongressParty",believe bharat jodo yatra would help congress regain foot,positive,
tweets_ajayacharya,"There were @RahulGandhi chamchas at #BharatJodoYatra with T-Shirts saying ""Walking for a job"".
They must know that getting a job under @narendramodi govt is like a walk in the park. https://t.co/NFimGufZCR",chamchas tshirts say walk job must know get job govt like walk park,negative,hate
tweets_thewire_in,"The march will allow the Congress to assert its political and social plank, but will it be enough to challenge the Modi dispensation and structurally weaken the fascist tendencies of the BJP-led government? | Shivasundar
#BharatJodoYatra
https://t.co/rP0yAdVuAh",march allow congress assert political social plank enough challenge modi dispensation structurally weaken fascist tendency bjpled government shivasundar,positive,
tweets_TimesNow,"Siddaramaiah Missing From Poster: What Is Fishy About Karnataka Leg Of Cong's Bharat Jodo Campaign?

#TNDIGITALVIDEOS #BharatJodoYatra   #Siddaramaiah https://t.co/wQHauIshoJ",siddaramaiah miss poster fishy karnataka leg congs bharat jodo campaign,positive,
tweets_archimags,"Now that Rahul Gandhi has started the #BharatJodoYatra, people want him to speak about this and that - but how many of these same people are speaking up for Rahul Gandhi or supporting his efforts? 🤨

(btw that hashtag doesn't show up automatically in list of suggested hashtags)",rahul gandhi start people want speak many people speak rahul gandhi support effort btw hashtag doesnt show automatically list suggest hashtags,positive,
tweets_nallarasu,"From the moment BJP started it's onslaught on opposition in the Bhima Koregaon case with the help of Pegasus spyware, valiant CPI and CPM are absconding and still not able to seen in the scene. Strange way of defending democracy!
#BharatJodoYatra https://t.co/j4N3qRFqf4",moment bjp start onslaught opposition bhima koregaon case help pegasus spyware valiant cpi cpm abscond still not able see scene strange way defend democracy,negative,hate
tweets_ANSHUBAJPAI1,"@INCUttarPradesh @RahulGandhi Today during #BharatJodoYatra Shri Rahul Gandhi interacted with influential people in Kerala. The purpose of this yatra is to eradicate hatred from the country, to spread the message of love and brotherhood.
The shared participation of all of you is very important in this goal. https://t.co/k6p8UlpxgF",today shri rahul gandhi interact influential people kerala purpose yatra eradicate hatred country spread message love brotherhood share participation important goal,positive,
tweets_MisalPav99,He will do a #BharatJodoYatra and then immediately go on a foreign vacation. Sab gud-gobar ek baar me.,immediately go foreign vacation sab gudgobar ek baar,negative,critisism
tweets_PrashantPolamp1,"@BJP4India is bringing back its
#EkBharatSreshtaBharat (Vividhata mein ekta) campaign to counter #BharatJodoYatra. It can be clearly seen in all it's social media platforms. https://t.co/DHYxBYlceq",bring back vividhata mein ekta campaign counter clearly see social medium platform,positive,
tweets_DeekshaNRaut,#BharatJodoYatra is important especially for those people who think a pic of burning shorts is more offensive than hate speech of Mr N@rsinghanand.,important especially people think pic burn short offensive hate speech mr n,negative,hate
tweets_DS_Rajasthan,It’s time to look at these shorts as half empty..not full pants…     #BharatJodoYatra https://t.co/Yca0bbRjWf,time look short half emptynot full pant,positive,
tweets_ArmanNeyazi,"@ReenaAdhikari12 #BharatJodoYatra 
My favourite till date 📅 https://t.co/Qd2XbSDkzG",favourite till date,positive,
tweets_mahendarsama,"Rising unemployment engulfs the lives of the youths of this nation! 

#BharatJodoYatra, a fight to save the aspirations of the Youths. https://t.co/ebrmrft3Q9",rise unemployment engulfs live youths nation fight save aspiration youth,negative,critisism
tweets_chickukottaram,"""With this padayatra of @RahulGandhi, @INCIndia will be revived. Will come into power, i hoped.
People of India will have a better future. 
I'm 76 years old. Congress means my life. 
That's why I'm participating in this journey.""
#BharatJodoYatra #RaGa #keralamodel #GyanvapiCase https://t.co/GAbX3cS9dH",padayatra revive come power hop people india good future im 76 year old congress mean life thats im participate journey,positive,
tweets_FellowcitizenEs,"Power of Liberty,secularism,freedom, love&amp;affection is more than anything in this World for Human Beings #BharatJodoYatra🇮🇳@INCIndia will set right everything and make India to feel her Pride once again. @RahulGandhi on a great mission 🔥❤️

 https://t.co/kUSV3jgIY6",power libertysecularismfreedom loveampaffection anything world human set right everything make india feel pride great mission,positive,
tweets_Gurda_Kaleja,"Chhota Recharge will be Disast in Gujarat!!  😒😒

#BharatJodoYatra",chhota recharge disast gujarat,negative,hate
tweets_gangaram_raju,"Jhoot ki Rani #SmritiIrani who
Lied about her degree,
Lied about #SillySouls cafe bar.
#BharatJodoYatra https://t.co/XJVGg4L7Mc",jhoot ki rani lie degree lie cafe bar,negative,hate
tweets_Thecorruptorr,@Shehzad_Ind @himantabiswa Chowkidar @Shehzad_Ind fresh from the felicitation of the 11 rapists &amp; murderers #JusticeforBilkisBano ex Congress cadres to Join the #BharatJodoYatra,chowkidar fresh felicitation 11 rapist murderer ex congress cadre join,negative,hate
tweets_SevadalBUD,"Today, on 13th September 2022, after the traditional flag hoisting and the national anthem, India Jodo Yatra has moved towards its new stage.

#BharatJodoYatra https://t.co/GmR5NPVEVX",today 13th september 2022 traditional flag hoist national anthem india jodo yatra move towards new stage,positive,
tweets_radheshyamz,Govt of India's most Illiterate IAS cader Doney GM BSNL Aurangabad must be pulled and pushed in such a way by @PMOIndia + @dot_india. Show him to the nation about the illegal works he did along with his Sarkari Gunda punters! Shame on @cmdbsnl @cgm_mh_bsnl #BharatJodoYatra https://t.co/j0XhrFUmsL,govt india illiterate ia cader doney gm bsnl aurangabad must pull pushed way show nation illegal work along sarkari gunda punter shame,negative,hate
tweets_mahendarsama,"In their eyes we see innocence.
In their eyes we see hope.😎

We will not let that glint fade away because a few have taken the easy path of hate.

India's dreams will shine on 🇮🇳

#BharatJodoYatra https://t.co/VFne4svwSd",eye see innocence eye see hope not let glint fade away take easy path hate indias dream shine,positive,
tweets_PiyushWakodikr,"With gushing winds comes a crowd gushing with trust and enthusiasm.

#BharatJodoYatra 🇮🇳 https://t.co/B5pILT0wok",gush wind come crowd gush trust enthusiasm,positive,
tweets_vu2ben,#BharatJodoYatra Chinese are laughing away on Indian media reports quoting Modi Govt that India and China have vacated to either side of LAC. China has withdrawn from Indian land and India has withdrawn from Indian land. China claimsWhat mine in mine and what is your is also mine,chinese laugh away indian medium report quote modi govt india china vacate either side lac china withdrawn indian land india withdrawn indian land china claimswhat mine mine also mine,negative,critisism
tweets_mdabid181,"Nafrat chodo Bharat jodo. 
-----------------------------------------
The moments to be treasured during the
#BharatJodoYatra
#myleaderrahulgandhiji https://t.co/q8BXK3GhL5",nafrat chodo bharat jodo moment treasure,positive,
tweets_NooruddinSonu,"Rahul ji doing wonderful think and trying to unite all the people together.
By doing this padayatra we are able to to meet greet and get their love and affection.
#BharatJodoYatra https://t.co/nf0G5imBYL",rahul ji wonderful think try unite people together padayatra able meet greet get love affection,positive,
tweets_imlnk,@AshokChandnaINC It’s time to unite not fight with each other. Keep ur differences aside #BharatJodoYatra,time unite not fight keep ur difference aside,positive,
tweets_IamPolSol,"How sick! Congress should keep religion away from cricket. This party has already divided the nation into 3, now doing drama over #BharatJodoYatra

And they say Modi divides India 😠 https://t.co/j7Zu5s83rV",sick congress keep religion away cricket party already divide nation 3 drama say modi divide india,negative,hate
tweets_Rajeshkumar490,"Sun Already Set But, We Can Able To See A Ray Of Hope In Dense Darkness 🔥🔥🔥
i. e, Shri. @RahulGandhi Ji

#RahulGandhi #BharatJodoYatra https://t.co/QRDM8hEym6",sun already set able see ray hope dense darkness e shri ji,positive,
tweets_imamhulagur,"No drama. No script. No PR.
Just pure love and care @RahulGandhi ❤️

#BharatJodoYatra https://t.co/aM8lWmD8jW",drama script pr pure love care,positive,
